{
  "schema_version": "0.1",
  "document_id": "B1",
  "theme_id": "theme_default",
  "slides": [
    {
      "slide_no": null,
      "component_id": "comp_title_bullets",
      "message": "[BACKGROUND]",
      "slots": {
        "TITLE": "[BACKGROUND]",
        "BULLETS": [
          "Page 1 | ローカルAI 技術調査レポート",
          "[IMAGE]",
          "Windows Tier（完全版表1）",
          "W-CPU1 / W-CPU2 / G-8 / G-12 の現実ライン",
          "[TABLE]"
        ]
      },
      "citations": [
        {
          "mark": "※1",
          "page": 1,
          "chunk_id": "s001_bg000"
        }
      ]
    }
  ],
  "toc": [
    {
      "title": "[BACKGROUND]",
      "level": 1,
      "slide_index": 1
    }
  ]
}