{
  "schema_version": "0.1",
  "document_id": "A2",
  "theme_id": "theme_default",
  "slides": [
    {
      "slide_no": null,
      "component_id": "comp_title_bullets",
      "message": "[BACKGROUND]",
      "slots": {
        "TITLE": "[BACKGROUND]",
        "BULLETS": [
          "Page 1 | ローカルAI 技術調査レポート",
          "カテゴリ別代表モデル・ランタイム・主用途",
          "[IMAGE]",
          "ローカルAIランドスケープ（詳細）",
          "[IMAGE]",
          "テキストLLM",
          "形式:",
          "GGUF (llama.cpp必須), GPTQ/AWQ/EXL2 (GPU向け)"
        ]
      },
      "citations": [
        {
          "mark": "※1",
          "page": 1,
          "chunk_id": "s001_bg000"
        }
      ]
    }
  ],
  "toc": [
    {
      "title": "[BACKGROUND]",
      "level": 1,
      "slide_index": 1
    }
  ]
}