{
  "schema_version": "0.1",
  "document_id": "kanji_deck",
  "theme_id": "theme_default",
  "toc": [
    {
      "title": "一次情報の収集・安全化・構造化による生成AI活用の試作",
      "level": 1,
      "slide_index": 1
    },
    {
      "title": "モデル差より、一次情報の収集と入力設計が価値になる",
      "level": 1,
      "slide_index": 2
    },
    {
      "title": "今回紹介する3つのユースケース",
      "level": 1,
      "slide_index": 3
    },
    {
      "title": "会議コンテキストを収集し、マスキング後に外部生成AIで壁打ち品質を上げる",
      "level": 1,
      "slide_index": 4
    },
    {
      "title": "ユースケース1では、会議文脈の価値と安全性を両立させる",
      "level": 1,
      "slide_index": 5
    },
    {
      "title": "会議・議事録から、ローカル完結で報告資料や提案資料を生成する",
      "level": 1,
      "slide_index": 6
    },
    {
      "title": "ユースケース2では、中間表現とテンプレート選択で品質を固定する",
      "level": 1,
      "slide_index": 7
    },
    {
      "title": "自作ノート・公開資料・許諾済み資料を学習コンテンツ化する",
      "level": 1,
      "slide_index": 8
    },
    {
      "title": "3ユースケースに共通する考え方",
      "level": 1,
      "slide_index": 9
    },
    {
      "title": "一次情報の収集から成果物化までの全体フロー",
      "level": 1,
      "slide_index": 10
    },
    {
      "title": "実装状況と今後の課題",
      "level": 1,
      "slide_index": 11
    }
  ],
  "slides": [
    {
      "slide_no": 1,
      "component_id": "comp_title_bullets",
      "message": "一次情報の収集・安全化・構造化による生成AI活用の試作",
      "slots": {
        "TITLE": "一次情報の収集・安全化・構造化による生成AI活用の試作",
        "BULLETS": []
      },
      "citations": [
        {
          "mark": "※1",
          "page": 1,
          "chunk_id": "c_dummy"
        }
      ]
    },
    {
      "slide_no": 2,
      "component_id": "comp_title_bullets",
      "message": "モデル差より、一次情報の収集と入力設計が価値になる",
      "slots": {
        "TITLE": "モデル差より、一次情報の収集と入力設計が価値になる",
        "BULLETS": []
      },
      "citations": [
        {
          "mark": "※1",
          "page": 1,
          "chunk_id": "c_dummy"
        }
      ]
    },
    {
      "slide_no": 3,
      "component_id": "comp_title_bullets",
      "message": "今回紹介する3つのユースケース",
      "slots": {
        "TITLE": "今回紹介する3つのユースケース",
        "BULLETS": []
      },
      "citations": [
        {
          "mark": "※1",
          "page": 1,
          "chunk_id": "c_dummy"
        }
      ]
    },
    {
      "slide_no": 4,
      "component_id": "comp_title_bullets",
      "message": "会議コンテキストを収集し、マスキング後に外部生成AIで壁打ち品質を上げる",
      "slots": {
        "TITLE": "会議コンテキストを収集し、マスキング後に外部生成AIで壁打ち品質を上げる",
        "BULLETS": []
      },
      "citations": [
        {
          "mark": "※1",
          "page": 1,
          "chunk_id": "c_dummy"
        }
      ]
    },
    {
      "slide_no": 5,
      "component_id": "comp_title_bullets",
      "message": "ユースケース1では、会議文脈の価値と安全性を両立させる",
      "slots": {
        "TITLE": "ユースケース1では、会議文脈の価値と安全性を両立させる",
        "BULLETS": []
      },
      "citations": [
        {
          "mark": "※1",
          "page": 1,
          "chunk_id": "c_dummy"
        }
      ]
    },
    {
      "slide_no": 6,
      "component_id": "comp_title_bullets",
      "message": "会議・議事録から、ローカル完結で報告資料や提案資料を生成する",
      "slots": {
        "TITLE": "会議・議事録から、ローカル完結で報告資料や提案資料を生成する",
        "BULLETS": []
      },
      "citations": [
        {
          "mark": "※1",
          "page": 1,
          "chunk_id": "c_dummy"
        }
      ]
    },
    {
      "slide_no": 7,
      "component_id": "comp_title_bullets",
      "message": "ユースケース2では、中間表現とテンプレート選択で品質を固定する",
      "slots": {
        "TITLE": "ユースケース2では、中間表現とテンプレート選択で品質を固定する",
        "BULLETS": []
      },
      "citations": [
        {
          "mark": "※1",
          "page": 1,
          "chunk_id": "c_dummy"
        }
      ]
    },
    {
      "slide_no": 8,
      "component_id": "comp_title_bullets",
      "message": "自作ノート・公開資料・許諾済み資料を学習コンテンツ化する",
      "slots": {
        "TITLE": "自作ノート・公開資料・許諾済み資料を学習コンテンツ化する",
        "BULLETS": []
      },
      "citations": [
        {
          "mark": "※1",
          "page": 1,
          "chunk_id": "c_dummy"
        }
      ]
    },
    {
      "slide_no": 9,
      "component_id": "comp_title_bullets",
      "message": "3ユースケースに共通する考え方",
      "slots": {
        "TITLE": "3ユースケースに共通する考え方",
        "BULLETS": []
      },
      "citations": [
        {
          "mark": "※1",
          "page": 1,
          "chunk_id": "c_dummy"
        }
      ]
    },
    {
      "slide_no": 10,
      "component_id": "comp_title_bullets",
      "message": "一次情報の収集から成果物化までの全体フロー",
      "slots": {
        "TITLE": "一次情報の収集から成果物化までの全体フロー",
        "BULLETS": []
      },
      "citations": [
        {
          "mark": "※1",
          "page": 1,
          "chunk_id": "c_dummy"
        }
      ]
    },
    {
      "slide_no": 11,
      "component_id": "comp_title_bullets",
      "message": "実装状況と今後の課題",
      "slots": {
        "TITLE": "実装状況と今後の課題",
        "BULLETS": []
      },
      "citations": [
        {
          "mark": "※1",
          "page": 1,
          "chunk_id": "c_dummy"
        }
      ]
    }
  ]
}