{
    "schema_version": "0.1",
    "document_id": "doc_001",
    "theme_id": "theme_default",
    "toc": [
      { "title": "オンボーディングの目的", "level": 1, "slide_index": 2 }
    ],
    "slides": [
      {
        "slide_no": 1,
        "component_id": "comp_cover",
        "slots": {
          "TITLE": "オンボーディング概要",
          "SUBTITLE": "抽出資料に基づく要点整理"
        },
        "citations": [
          { "mark": "※1", "page": 2, "chunk_id": "c_0001" }
        ]
      },
      {
        "slide_no": 2,
        "component_id": "comp_title_bullets",
        "slots": {
          "TITLE": "オンボーディングの目的",
          "BULLETS": [
            "目的は早期戦力化です。※1"
          ]
        },
        "citations": [
          { "mark": "※1", "page": 2, "chunk_id": "c_0001", "bbox_pt": [72, 120, 800, 60] }
        ]
      }
    ]
  }